{
  "ai_report_json": {
    "language": "en",
    "sections": {
      "10_timestamp": "2026-02-02T18:05:46-06:00",
      "1_identificacion_vehiculo": "Mitsubishi L200, Year 2013, Protocol SAE J1939 CAN, Engine and VIN not specified.",
      "2_motivo_visita": "Customer reports airbag warning light illuminated on the dashboard.",
      "3_resultado_escaneo": "No Diagnostic Trouble Codes (DTCs) stored. Malfunction Indicator Lamp (MIL) is off. Readiness monitors for MIL and Components are complete; other monitors are not available or not supported.",
      "4_evidencia_datos_en_vivo": "Engine coolant temperature at 20°C, engine RPM at 0 rpm, vehicle speed at 0 km/h, throttle position and commanded throttle actuator at 100%, control module voltage at 12.12 V, intake manifold pressure at 90 kPa. Accelerator pedal positions at 0%.",
      "5_interpretacion_tecnica": "No DTCs related to the airbag system were retrieved via the SAE J1939 CAN protocol scan. The MIL is off, indicating no powertrain faults detected. Live data shows the engine is off or idling with throttle fully open, which may be a scan artifact or key-on engine-off state. The absence of airbag-related codes suggests the airbag control module may require a dedicated scan tool or protocol for fault retrieval.",
      "6_causas_probables": [
        {
          "causa": "Fault or communication issue in the airbag control module not detectable via generic SAE J1939 CAN scan.",
          "prioridad": "Alta"
        },
        {
          "causa": "Wiring or connector fault in the Supplemental Restraint System (SRS) circuit causing the airbag light to illuminate.",
          "prioridad": "Media"
        },
        {
          "causa": "Faulty airbag warning light bulb or dashboard cluster issue.",
          "prioridad": "Baja"
        }
      ],
      "7_pruebas_recomendadas": [
        {
          "criterio_confirmacion": "Presence of airbag-related DTCs confirms fault in airbag control module or related components.",
          "descripcion": "Perform a dedicated SRS/airbag system scan using manufacturer-specific diagnostic equipment or protocol to retrieve airbag-related DTCs.",
          "paso": 1
        },
        {
          "criterio_confirmacion": "Identification of wiring faults or connector issues confirms cause.",
          "descripcion": "Visually inspect and test wiring harness and connectors related to the airbag system for continuity, corrosion, or damage.",
          "paso": 2
        },
        {
          "criterio_confirmacion": "If the bulb fails to illuminate or behaves abnormally, cluster or bulb fault is confirmed.",
          "descripcion": "Check the airbag warning light operation on the instrument cluster for bulb functionality and proper illumination during key-on self-test.",
          "paso": 3
        }
      ],
      "8_acciones_recomendadas": [
        {
          "accion": "Repair or reprogram the airbag control module as per manufacturer procedures after confirming fault codes.",
          "causa": "Fault or communication issue in the airbag control module not detectable via generic SAE J1939 CAN scan."
        },
        {
          "accion": "Repair or replace damaged wiring or connectors in the SRS circuit.",
          "causa": "Wiring or connector fault in the Supplemental Restraint System (SRS) circuit causing the airbag light to illuminate."
        },
        {
          "accion": "Replace the airbag warning light bulb or repair/replace the instrument cluster as needed.",
          "causa": "Faulty airbag warning light bulb or dashboard cluster issue."
        }
      ],
      "9_notas_limitaciones": "Scan was performed using a generic SAE J1939 CAN protocol adapter (ELM327 v1.5) which may not support airbag system diagnostics. No airbag-specific DTCs were retrieved. Live data indicates engine off or key-on state; throttle data may not reflect actual driving conditions. Confirmation requires manufacturer-specific diagnostic tools."
    }
  },
  "ai_response": "<report>\n1) Vehicle identification\nM",
  "ai_response_raw": "<json>\n{\n  \"language\": \"en\",\n  \"sections\": {\n    \"1_identificacion_vehiculo\": \"Mitsubishi L200, Year 2013, Protocol SAE J1939 CAN, Engine and VIN not specified.\",\n    \"2_motivo_visita\": \"Customer reports airbag warning light illuminated on the dashboard.\",\n    \"3_resultado_escaneo\": \"No Diagnostic Trouble Codes (DTCs) stored. Malfunction Indicator Lamp (MIL) is off. Readiness monitors for MIL and Components are complete; other monitors are not available or not supported.\",\n    \"4_evidencia_datos_en_vivo\": \"Engine coolant temperature at 20°C, engine RPM at 0 rpm, vehicle speed at 0 km/h, throttle position and commanded throttle actuator at 100%, control module voltage at 12.12 V, intake manifold pressure at 90 kPa. Accelerator pedal positions at 0%.\",\n    \"5_interpretacion_tecnica\": \"No DTCs related to the airbag system were retrieved via the SAE J1939 CAN protocol scan. The MIL is off, indicating no powertrain faults detected. Live data shows the engine is off or idling with throttle fully open, which may be a scan artifact or key-on engine-off state. The absence of airbag-related codes suggests the airbag control module may require a dedicated scan tool or protocol for fault retrieval.\",\n    \"6_causas_probables\": [\n      {\n        \"prioridad\": \"Alta\",\n        \"causa\": \"Fault or communication issue in the airbag control module not detectable via generic SAE J1939 CAN scan.\"\n      },\n      {\n        \"prioridad\": \"Media\",\n        \"causa\": \"Wiring or connector fault in the Supplemental Restraint System (SRS) circuit causing the airbag light to illuminate.\"\n      },\n      {\n        \"prioridad\": \"Baja\",\n        \"causa\": \"Faulty airbag warning light bulb or dashboard cluster issue.\"\n      }\n    ],\n    \"7_pruebas_recomendadas\": [\n      {\n        \"paso\": 1,\n        \"descripcion\": \"Perform a dedicated SRS/airbag system scan using manufacturer-specific diagnostic equipment or protocol to retrieve airbag-related DTCs.\",\n        \"criterio_confirmacion\": \"Presence of airbag-related DTCs confirms fault in airbag control module or related components.\"\n      },\n      {\n        \"paso\": 2,\n        \"descripcion\": \"Visually inspect and test wiring harness and connectors related to the airbag system for continuity, corrosion, or damage.\",\n        \"criterio_confirmacion\": \"Identification of wiring faults or connector issues confirms cause.\"\n      },\n      {\n        \"paso\": 3,\n        \"descripcion\": \"Check the airbag warning light operation on the instrument cluster for bulb functionality and proper illumination during key-on self-test.\",\n        \"criterio_confirmacion\": \"If the bulb fails to illuminate or behaves abnormally, cluster or bulb fault is confirmed.\"\n      }\n    ],\n    \"8_acciones_recomendadas\": [\n      {\n        \"causa\": \"Fault or communication issue in the airbag control module not detectable via generic SAE J1939 CAN scan.\",\n        \"accion\": \"Repair or reprogram the airbag control module as per manufacturer procedures after confirming fault codes.\"\n      },\n      {\n        \"causa\": \"Wiring or connector fault in the Supplemental Restraint System (SRS) circuit causing the airbag light to illuminate.\",\n        \"accion\": \"Repair or replace damaged wiring or connectors in the SRS circuit.\"\n      },\n      {\n        \"causa\": \"Faulty airbag warning light bulb or dashboard cluster issue.\",\n        \"accion\": \"Replace the airbag warning light bulb or repair/replace the instrument cluster as needed.\"\n      }\n    ],\n    \"9_notas_limitaciones\": \"Scan was performed using a generic SAE J1939 CAN protocol adapter (ELM327 v1.5) which may not support airbag system diagnostics. No airbag-specific DTCs were retrieved. Live data indicates engine off or key-on state; throttle data may not reflect actual driving conditions. Confirmation requires manufacturer-specific diagnostic tools.\",\n    \"10_timestamp\": \"2026-02-02T18:05:46-06:00\"\n  }\n}\n</json>\n<report>\n1) Vehicle identification\nM",
  "created_at": "2026-02-03T00:05:46.059665+00:00",
  "customer_notes": "Airbag light on",
  "model": "gpt-4.1-mini",
  "report_id": "4b0e9c8f",
  "report_language": "en",
  "scan_data": {
    "dtcs": [],
    "live_data": {
      "05": {
        "name": "Engine Coolant Temperature",
        "unit": "°C",
        "value": 20.0
      },
      "0B": {
        "name": "Intake Manifold Pressure",
        "unit": "kPa",
        "value": 90.0
      },
      "0C": {
        "name": "Engine RPM",
        "unit": "rpm",
        "value": 0.0
      },
      "0D": {
        "name": "Vehicle Speed",
        "unit": "km/h",
        "value": 0.0
      },
      "11": {
        "name": "Throttle Position",
        "unit": "%",
        "value": 100.0
      },
      "42": {
        "name": "Control Module Voltage",
        "unit": "V",
        "value": 12.12
      },
      "45": {
        "name": "Relative Throttle Position",
        "unit": "%",
        "value": 100.0
      },
      "49": {
        "name": "Accelerator Pedal Position D",
        "unit": "%",
        "value": 0.0
      },
      "4A": {
        "name": "Accelerator Pedal Position E",
        "unit": "%",
        "value": 0.0
      },
      "4C": {
        "name": "Commanded Throttle Actuator",
        "unit": "%",
        "value": 100.0
      }
    },
    "readiness": {
      "A/C Refrigerant": {
        "available": false,
        "complete": false,
        "status": "N/A"
      },
      "Catalyst": {
        "available": false,
        "complete": false,
        "status": "N/A"
      },
      "Components": {
        "available": true,
        "complete": true,
        "status": "Complete"
      },
      "EGR System": {
        "available": false,
        "complete": false,
        "status": "N/A"
      },
      "Evaporative System": {
        "available": false,
        "complete": false,
        "status": "N/A"
      },
      "Fuel System": {
        "available": false,
        "complete": false,
        "status": "N/A"
      },
      "Heated Catalyst": {
        "available": false,
        "complete": false,
        "status": "N/A"
      },
      "MIL (Check Engine Light)": {
        "available": true,
        "complete": true,
        "status": "Complete"
      },
      "Misfire": {
        "available": false,
        "complete": false,
        "status": "N/A"
      },
      "Oxygen Sensor": {
        "available": false,
        "complete": false,
        "status": "N/A"
      },
      "Oxygen Sensor Heater": {
        "available": false,
        "complete": false,
        "status": "N/A"
      },
      "Secondary Air": {
        "available": false,
        "complete": false,
        "status": "N/A"
      }
    },
    "vehicle_info": {
      "dtc_count": "0",
      "elm_version": "ELM327 v1.5",
      "headers_mode": "ON",
      "mil_on": "No",
      "protocol": "SAE J1939 CAN",
      "vin_raw": "4902014D4D42214A4E4B423430432244303439363838"
    }
  },
  "status": "complete"
}
